{
  "schema_version": "1.0.0",
  "profile_id": "example-counterparty-profile",
  "profile_version": "1.0.0",
  "publisher": {
    "agent_or_business_ref": "example-counterparty",
    "identity_evidence_ref": "public:example-identity-evidence"
  },
  "updated_at": "2026-08-30T00:00:00Z",
  "expires_at": "2026-09-29T00:00:00Z",
  "world_model": {
    "model_id": "agent-business-world-model",
    "schema_version": "1.0.0"
  },
  "conventions": [
    {
      "id": "evidence-provenance",
      "spec_version": "1.0.0",
      "support_state": "tested",
      "required_for_transaction": true,
      "fallback": null,
      "test_evidence_ref": "public:test:evidence-provenance",
      "tested_at": "2026-08-29T00:00:00Z",
      "production_evidence_ref": null,
      "observed_at": null,
      "observation_scope": null,
      "verifier_ref": null,
      "verification_evidence_ref": null,
      "verified_at": null,
      "evidence_expires_at": "2026-09-29T00:00:00Z"
    },
    {
      "id": "bounded-authority",
      "spec_version": "1.0.0",
      "support_state": "tested",
      "required_for_transaction": true,
      "fallback": null,
      "test_evidence_ref": "public:test:bounded-authority",
      "tested_at": "2026-08-29T00:00:00Z",
      "production_evidence_ref": null,
      "observed_at": null,
      "observation_scope": null,
      "verifier_ref": null,
      "verification_evidence_ref": null,
      "verified_at": null,
      "evidence_expires_at": "2026-09-29T00:00:00Z"
    },
    {
      "id": "economic-state-separation",
      "spec_version": "1.0.0",
      "support_state": "tested",
      "required_for_transaction": true,
      "fallback": null,
      "test_evidence_ref": "public:test:economic-state-separation",
      "tested_at": "2026-08-29T00:00:00Z",
      "production_evidence_ref": null,
      "observed_at": null,
      "observation_scope": null,
      "verifier_ref": null,
      "verification_evidence_ref": null,
      "verified_at": null,
      "evidence_expires_at": "2026-09-29T00:00:00Z"
    },
    {
      "id": "machine-proposal",
      "spec_version": "1.0.0",
      "support_state": "declared",
      "required_for_transaction": false,
      "fallback": "human_reviewed_proposal_document",
      "test_evidence_ref": null,
      "tested_at": null,
      "production_evidence_ref": null,
      "observed_at": null,
      "observation_scope": null,
      "verifier_ref": null,
      "verification_evidence_ref": null,
      "verified_at": null,
      "evidence_expires_at": null
    }
  ],
  "publication": {
    "canonical_profile_url": "https://example.invalid/.well-known/agent-business-compatibility.json",
    "transport_hints": ["a2a", "mcp", "http"]
  },
  "disclosure": {
    "contains_secrets": false,
    "contains_credentials": false,
    "contains_private_customer_data": false,
    "contains_private_prompts": false,
    "public_disclosure_confirmed": true
  },
  "compatibility_grants_authority": false,
  "certification_claim": null
}
